{
  "caseId": "04-location-modes-004",
  "categories": [
    "location_modes"
  ],
  "note": "開催形式が offline と判定されること。",
  "clock": "2026-09-21T09:00:00+09:00",
  "preferences": {
    "interestsPrompt": "ハッカソン 生成AI カンファレンス ミートアップ ピッチ",
    "targetYear": 2026,
    "onlineAllowed": true,
    "locations": [
      "大阪",
      "関西",
      "東京"
    ]
  },
  "searchHits": [
    {
      "url": "https://mode4.example.jp/e",
      "query": "イベント 2026"
    }
  ],
  "pages": [
    {
      "url": "https://mode4.example.jp/e",
      "body": "<html><head><title>開催形式テスト 4 2026</title></head><body><h1>開催形式テスト 4 2026</h1><p>地域の課題を解くイベントです。参加者を募集しています。</p><div>開催日: 2026年10月8日 19:00</div><div>申込締切: 2026年10月1日 23:59</div><div>会場: 京都リサーチパーク</div><div>主催: Example</div></body></html>",
      "sourceType": "official"
    }
  ],
  "expected": {
    "events": [
      {
        "officialUrl": "https://mode4.example.jp/e",
        "eventStart": "2026-10-08T19:00:00+09:00",
        "eventStartPrecision": "datetime",
        "applicationDeadline": "2026-10-01T23:59:00+09:00",
        "applicationDeadlinePrecision": "datetime",
        "locationType": "offline",
        "validationStatus": "verified",
        "evidenceRequired": [
          "title",
          "dates.eventStart"
        ],
        "title": "開催形式テスト 4 2026"
      }
    ]
  }
}
