{
  "caseId": "03-multi-day-001",
  "categories": [
    "multi_day"
  ],
  "note": "複数日開催。eventEnd を取り、日付順序が壊れないこと。",
  "clock": "2026-09-21T09:00:00+09:00",
  "preferences": {
    "interestsPrompt": "ハッカソン 生成AI カンファレンス ミートアップ ピッチ",
    "targetYear": 2026,
    "onlineAllowed": true,
    "locations": [
      "大阪",
      "関西",
      "東京"
    ]
  },
  "searchHits": [
    {
      "url": "https://multiday1.example.jp/e",
      "query": "イベント 2026"
    }
  ],
  "pages": [
    {
      "url": "https://multiday1.example.jp/e",
      "body": "<html><head><title>複数日ハッカソン 1 2026</title></head><body><h1>複数日ハッカソン 1 2026</h1><p>地域の課題を解くイベントです。参加者を募集しています。</p><div>開催日: 2026年10月11日 10:00 〜 10月12日 18:00</div><div>申込締切: 2026年10月1日 23:59</div><div>会場: グランフロント大阪</div><div>主催: Example</div></body></html>",
      "sourceType": "official"
    }
  ],
  "expected": {
    "events": [
      {
        "officialUrl": "https://multiday1.example.jp/e",
        "eventStart": "2026-10-11T10:00:00+09:00",
        "eventStartPrecision": "datetime",
        "applicationDeadline": "2026-10-01T23:59:00+09:00",
        "applicationDeadlinePrecision": "datetime",
        "locationType": "offline",
        "validationStatus": "verified",
        "evidenceRequired": [
          "title",
          "dates.eventStart"
        ],
        "eventEnd": "2026-10-12T18:00:00+09:00",
        "title": "複数日ハッカソン 1 2026"
      }
    ]
  }
}
