{
  "caseId": "01-deadline-clear-007",
  "categories": [
    "deadline_clear"
  ],
  "note": "申込締切と開催日が両方明記されている基本ケース。",
  "clock": "2026-09-21T09:00:00+09:00",
  "preferences": {
    "interestsPrompt": "ハッカソン 生成AI カンファレンス ミートアップ ピッチ",
    "targetYear": 2026,
    "onlineAllowed": true,
    "locations": [
      "大阪",
      "関西",
      "東京"
    ]
  },
  "searchHits": [
    {
      "url": "https://official7.example.jp/e/2026",
      "query": "イベント 2026"
    }
  ],
  "pages": [
    {
      "url": "https://official7.example.jp/e/2026",
      "body": "<html><head><title>関西セキュリティカンファレンス 2026</title></head><body><h1>関西セキュリティカンファレンス 2026</h1><p>地域の課題を解くイベントです。参加者を募集しています。</p><div>開催日: 2026年11月26日 10:00</div><div>申込締切: 2026年11月12日 23:59</div><div>会場: 大阪国際会議場</div><div>主催: 主催7</div></body></html>",
      "sourceType": "official"
    }
  ],
  "expected": {
    "events": [
      {
        "officialUrl": "https://official7.example.jp/e/2026",
        "eventStart": "2026-11-26T10:00:00+09:00",
        "eventStartPrecision": "datetime",
        "applicationDeadline": "2026-11-12T23:59:00+09:00",
        "applicationDeadlinePrecision": "datetime",
        "locationType": "offline",
        "validationStatus": "verified",
        "evidenceRequired": [
          "title",
          "dates.eventStart"
        ],
        "title": "関西セキュリティカンファレンス 2026"
      }
    ]
  }
}
