{
  "caseId": "11-aggregator-only-001",
  "categories": [
    "aggregator_only"
  ],
  "note": "集約サイト1件のみが出典で締切も未掲載。confidence が 0.60 未満になり、一覧に出ないこと（画面設計書§8-2）。",
  "clock": "2026-09-21T09:00:00+09:00",
  "preferences": {
    "interestsPrompt": "ハッカソン 生成AI カンファレンス ミートアップ ピッチ",
    "targetYear": 2026,
    "onlineAllowed": true,
    "locations": [
      "大阪",
      "関西",
      "東京"
    ]
  },
  "searchHits": [
    {
      "url": "https://matome1.example.jp/e",
      "query": "イベント 2026"
    }
  ],
  "pages": [
    {
      "url": "https://matome1.example.jp/e",
      "body": "<html><head><title>集約サイト掲載イベント 1 2026</title></head><body><h1>集約サイト掲載イベント 1 2026</h1><p>地域の課題を解くイベントです。参加者を募集しています。</p><div>開催日: 2026年11月14日 13:00</div><div>会場: グランフロント大阪</div><div>主催: Example</div></body></html>",
      "sourceType": "aggregator"
    }
  ],
  "expected": {
    "events": [
      {
        "officialUrl": "https://matome1.example.jp/e",
        "eventStart": "2026-11-14T13:00:00+09:00",
        "eventStartPrecision": "datetime",
        "applicationDeadline": null,
        "applicationDeadlinePrecision": "unknown",
        "locationType": "offline",
        "validationStatus": "quarantined",
        "evidenceRequired": [
          "title",
          "dates.eventStart"
        ],
        "title": "集約サイト掲載イベント 1 2026"
      }
    ],
    "notProduced": [
      "https://matome1.example.jp/e"
    ]
  }
}
