{
  "caseId": "05-year-partial-003",
  "categories": [
    "year_partial"
  ],
  "note": "ページ上の年が2026だけなので、年なしの開催日を補完してよい。",
  "clock": "2026-09-21T09:00:00+09:00",
  "preferences": {
    "interestsPrompt": "ハッカソン 生成AI カンファレンス ミートアップ ピッチ",
    "targetYear": 2026,
    "onlineAllowed": true,
    "locations": [
      "大阪",
      "関西",
      "東京"
    ]
  },
  "searchHits": [
    {
      "url": "https://yearone3.example.jp/e",
      "query": "イベント 2026"
    }
  ],
  "pages": [
    {
      "url": "https://yearone3.example.jp/e",
      "body": "<html><head><title>年補完テスト 3</title></head><body><h1>年補完テスト 3</h1><p>2026年のイベントです。参加者を募集しています。</p><div>開催日: 11月7日 14:00</div><div>会場: グランフロント大阪</div><div>主催: Example</div></body></html>",
      "sourceType": "official"
    }
  ],
  "expected": {
    "events": [
      {
        "officialUrl": "https://yearone3.example.jp/e",
        "eventStart": "2026-11-07T14:00:00+09:00",
        "eventStartPrecision": "datetime",
        "applicationDeadline": null,
        "applicationDeadlinePrecision": "unknown",
        "locationType": "offline",
        "validationStatus": "partial",
        "evidenceRequired": [
          "title",
          "dates.eventStart"
        ],
        "title": "年補完テスト 3"
      }
    ]
  }
}
